{
  "schemaVersion": "molit.commercial-readiness-register/1",
  "asOf": "2026-07-14",
  "target": "commercial-production",
  "baseline": "docs/02-design/commercial-caas-dsaas-baseline.md",
  "gates": [
    {
      "gateId": "COM-TEN-001",
      "phase": "P0",
      "status": "partial",
      "summary": "PostgreSQL FORCE RLS, database principal binding, tenant별 상태·queue·object reference·secret reference·metric·감사 격리와 동적 등록 원자성을 실제 PostgreSQL에서 검증했다. 외부 저장소와 비밀 관리 체계의 운영 격리 증거는 별도다.",
      "evidencePaths": ["deploy/control-store/postgres/002_normalized_projection.sql", "src/control-store/postgres-tenant-store.mjs", "tests/integration/tenant-isolation-postgres.test.mjs", "tests/integration/normalized-control-store-docker.test.mjs"],
      "resultEvidence": [],
      "blockers": [
        { "id": "COM-TEN-INFRA-ISOLATION", "summary": "운영 object storage bucket policy, Vault ACL과 cluster network policy를 대상으로 한 교차 tenant 침투시험 및 승인 결과가 없다.", "owner": "platform-security" }
      ]
    },
    {
      "gateId": "COM-LCM-001",
      "phase": "P0",
      "status": "partial",
      "summary": "Kubernetes EDC provisioner가 create, upgrade, rollback, suspend, delete, stale fencing 거부와 orphan 회수를 수행한다. 로컬 kind 반복시험과 운영 cluster 승인시험은 구분한다.",
      "evidencePaths": ["src/caas/kubernetes-provisioner.mjs", "src/caas/orphan-recovery.mjs", "deploy/kubernetes/run-kind-integration.ps1", "tests/integration/kubernetes-lifecycle-repeat.test.mjs"],
      "resultEvidence": [],
      "blockers": [
        { "id": "COM-LCM-K8S-PROVISIONER", "summary": "승인된 운영 cluster, 최종 image, Gateway·DNS와 비밀 backend를 사용한 30회 수명주기 결과 및 운영자 서명이 없다.", "owner": "connector-platform" }
      ]
    },
    {
      "gateId": "COM-ID-001",
      "phase": "P0",
      "status": "partial",
      "summary": "개발·상호운용 경로에는 OIDC JWKS를, production 경로에는 RFC 7662 startup probe와 TTL readiness를 적용했다. 사람 MFA claim, service mTLS certificate binding, 폐기 조회와 inbound·outbound 인증서 회전도 구현했다. 운영기관 신원 체계의 ceremony 증거는 별도다.",
      "evidencePaths": ["src/identity/runtime.mjs", "src/identity/tls-runtime.mjs", "deploy/identity/keycloak/run-integration.ps1", "tests/integration/identity-production-tls.test.mjs", "tests/integration/identity-keycloak.test.mjs"],
      "resultEvidence": [],
      "blockers": [
        { "id": "COM-ID-OPERATING-IDENTITY", "summary": "운영 IdP의 MFA·SAML ceremony, private CA·KMS의 workload credential 발급·회전·폐기와 DCP trust chain 승인 결과가 없다.", "owner": "identity-security" }
      ]
    },
    {
      "gateId": "COM-OBS-001",
      "phase": "P0",
      "status": "partial",
      "summary": "관리 요청의 trace·metric·log, PostgreSQL audit outbox의 WORM 반출, 비과금 usage 원장, SLO rule과 dashboard를 production runtime에 연결했다. 운영 backend의 보존·가용성 증거는 별도다.",
      "evidencePaths": ["src/observability/runtime-bundle.mjs", "src/observability/usage-meter.mjs", "deploy/observability/otel-collector.production.yaml", "deploy/observability/prometheus-rules.yaml", "tests/integration/observability-worm-dispatcher-postgres.test.mjs", "tests/integration/usage-meter-postgres.test.mjs"],
      "resultEvidence": [],
      "blockers": [
        { "id": "COM-OBS-OTEL-WORM", "summary": "운영 OTLP·WORM 제품의 가용성·보존·권한 시험과 관리 API부터 실제 DSP 계약·전송까지 이어진 상관관계 결과가 없다.", "owner": "service-operations" }
      ]
    },
    {
      "gateId": "COM-HA-001",
      "phase": "P0",
      "status": "partial",
      "summary": "3개 zone 배치 manifest, 동기 PostgreSQL quorum·WAL archive·PITR, target-side Kubernetes fencing과 primary 강제 종료·복원 harness를 구현했다. 로컬 장애주입은 운영 multi-zone 훈련을 대신하지 않는다.",
      "evidencePaths": ["deploy/kubernetes/ha/control-plane.template.yaml", "deploy/kubernetes/ha/postgres.template.yaml", "deploy/ha/postgres/run-ha-pitr.mjs", "tests/contract/ha-deployment.test.mjs", "tests/integration/kubernetes-lifecycle-repeat.test.mjs"],
      "resultEvidence": [],
      "blockers": [
        { "id": "COM-HA-EXTERNAL-FENCE", "summary": "운영 admission controller와 최종 EDC 자원에서 N+1 적용 뒤 지연된 N 명령이 거부된 서명 결과가 없다.", "owner": "connector-platform" },
        { "id": "COM-HA-FAILOVER-RESTORE", "summary": "운영 multi-zone PostgreSQL, queue와 object storage를 함께 중단·복구한 승인 RPO·RTO 훈련 결과가 없다.", "owner": "platform-sre" }
      ]
    },
    {
      "gateId": "COM-SUP-001",
      "phase": "P0",
      "status": "partial",
      "summary": "8개 runtime class 원장과 source build 6종, PostgreSQL·OTEL 외부 채택, SBOM, 무예외 취약점 Gate, runtimeClass·운영 적격성을 묶은 provenance·서명·fail-closed admission을 구현했다. EDC 두 plane은 P1 전까지 productionEligible=false이며 운영 registry 발행 증거는 없다.",
      "evidencePaths": ["deploy/images/build-sign-verify.ps1", "deploy/images/adopt-sign-verify.ps1", "deploy/images/verify-local-runtime-images.ps1", "deploy/supply-chain/runtime-image-inventory.v1.json", "deploy/supply-chain/verify-images.template.yaml", "contracts/supply-chain-runtime-image-inventory.v1.schema.json", "tools/supply-chain/attest.mjs", "tools/supply-chain/verify.mjs", "tests/contract/supply-chain-release-bundle.test.mjs", "tests/contract/supply-chain-admission.test.mjs", "tests/contract/supply-chain-runtime-inventory.test.mjs"],
      "resultEvidence": [],
      "blockers": [
        { "id": "COM-SUP-FINAL-IMAGES", "summary": "운영 registry와 KMS·HSM release key로 발행한 production-eligible 6종(CaaS, DSaaS, fencing webhook, EDC schema migration, PostgreSQL operand, OTEL Collector) digest의 최신 SBOM·scan·signature·provenance 및 admission 결과가 없다.", "owner": "software-supply-chain" }
      ]
    },
    {
      "gateId": "COM-TRUST-001",
      "phase": "P1",
      "status": "partial",
      "summary": "승인 만료·철회 상태는 강제하지만 서명된 기관 결정과 운영 trust anchor는 연결하지 않았다.",
      "evidencePaths": ["src/dsaas/approval-registry.mjs", "tests/unit/dsaas-control-plane.test.mjs"],
      "resultEvidence": [],
      "blockers": [
        { "id": "COM-TRUST-SIGNED-DECISIONS", "summary": "승인기관 서명 검증과 credential status·trust anchor 회전 증거가 없다.", "owner": "dataspace-governance" }
      ]
    },
    {
      "gateId": "COM-CAT-001",
      "phase": "P1",
      "status": "partial",
      "summary": "MOLIT DCAT-AP 검증과 Bridge 변환은 있으나 운영 federated Catalog 수집·중복·tombstone 시험은 없다.",
      "evidencePaths": ["profiles/molit-dcat-ap/releases/1.0.0-rc.1/manifest.json", "src/bridge-runtime/worker.mjs"],
      "resultEvidence": [],
      "blockers": [
        { "id": "COM-CAT-FEDERATED-RUNTIME", "summary": "운영 Catalog의 crawl·version·dedup·private visibility 수렴 증거가 없다.", "owner": "catalog-platform" }
      ]
    },
    {
      "gateId": "COM-POL-001",
      "phase": "P1",
      "status": "partial",
      "summary": "로컬 DSP 계약·전송 흐름은 실행했으나 승인 ODRL template과 종료 후 원천 권한 회수를 입증하지 않았다.",
      "evidencePaths": ["evidence/edc/local-interoperability-status.v1.json", "tests/edc/evidence-recorder.test.mjs"],
      "resultEvidence": [],
      "blockers": [
        { "id": "COM-POL-OBLIGATION-ENFORCEMENT", "summary": "Agreement 종료와 원천 시스템 권한 회수까지 연결한 정책 집행 증거가 없다.", "owner": "policy-contract" }
      ]
    },
    {
      "gateId": "COM-OPS-001",
      "phase": "P1",
      "status": "open",
      "summary": "구독·quota·지원·export·tenant 삭제를 하나의 관리형 서비스 수명주기로 구현하지 않았다.",
      "evidencePaths": [],
      "resultEvidence": [],
      "blockers": [
        { "id": "COM-OPS-SUBSCRIPTION-LIFECYCLE", "summary": "주문·plan 변경·quota·해지·export·삭제 API와 원장이 없다.", "owner": "product-operations" }
      ]
    },
    {
      "gateId": "COM-DSP-001",
      "phase": "P1",
      "status": "partial",
      "summary": "동일 EDC 구성의 로컬 수명주기는 확인했으나 최종 image TCK와 외부 구현 2종 시험은 없다.",
      "evidencePaths": ["evidence/edc/local-interoperability-status.v1.json", "deploy/edc/upstream-lock.json"],
      "resultEvidence": [],
      "blockers": [
        { "id": "COM-DSP-FINAL-IMAGE-TCK", "summary": "국토교통 확장과 설정을 포함한 최종 image의 DSP TCK 원시 출력이 없다.", "owner": "interoperability" },
        { "id": "COM-DSP-EXTERNAL-CONNECTORS", "summary": "서로 다른 외부 Connector 구현 2종과의 전체 수명주기 증거가 없다.", "owner": "interoperability" }
      ]
    },
    {
      "gateId": "COM-CMP-001",
      "phase": "P2",
      "status": "open",
      "summary": "적용 법령과 인증 범위, 개인정보 처리, 데이터 거주지, 보존·삭제, 외부 보안 검증을 확정하지 않았다.",
      "evidencePaths": [],
      "resultEvidence": [],
      "blockers": [
        { "id": "COM-CMP-APPLICABILITY-EVIDENCE", "summary": "적용성 결정, 개인정보 통제, 외부 침투시험과 업무 연속성 훈련 증거가 없다.", "owner": "risk-compliance" }
      ]
    },
    {
      "gateId": "COM-BIL-001",
      "phase": "P2",
      "status": "open",
      "summary": "유상거래 원장과 결제·세금·환불·수수료 조정 기능을 구현하지 않았다.",
      "evidencePaths": [],
      "resultEvidence": [],
      "blockers": [
        { "id": "COM-BIL-SCOPE-DECISION", "summary": "유상거래 포함 여부와 not-applicable 승인 중 어느 것도 확정되지 않았다.", "owner": "business-governance" }
      ]
    },
    {
      "gateId": "COM-SLA-001",
      "phase": "P2",
      "status": "open",
      "summary": "승인 capacity profile, 30일 canary와 월별 SLA 산출물을 만들지 않았다.",
      "evidencePaths": [],
      "resultEvidence": [],
      "blockers": [
        { "id": "COM-SLA-OPERATING-EVIDENCE", "summary": "가용성·제외시간·오류예산·service credit을 재현하는 운영 증거가 없다.", "owner": "service-management" }
      ]
    }
  ]
}
